{
  "id": "releases/2026-01-05/notes.json",
  "kind": "notes",
  "format": "notes/1.0",
  "provenance": {
    "release": "2026-01-05",
    "sources": ["example"],
    "licences": ["CC-BY-4.0"],
    "gbif_download_dois": ["10.0000/example"],
    "method": "test-1",
    "taxonomy": "test-taxonomy",
    "boundaries": "test-boundaries",
    "ranges": null,
    "protection": null,
    "code": "0.0.0",
    "run": "run-1"
  },
  "data": {
    "release": "2026-01-05",
    "previous": null,
    "results": {
      "added": 2,
      "changed": 0,
      "removed": 0
    },
    "key_changes": [],
    "corrections": [],
    "formats": []
  }
}
